<?xml version="1.0" encoding="UTF-8" ?>
<!DOCTYPE movie  SYSTEM "movie.dtd">
<?xml-stylesheet type="text/css" href="movie.css"?>
<!-- This XML document describes a movieÂ  -->
<movie>
   <director>Zack Snyder</director>
   <imdbRef>tt0770828</imdbRef>
   <year>2013</year>
   <metascore>55</metascore>
   <rottenTomatoes>82</rottenTomatoes>
   <keywords>
      <keyword>manofsteel</keyword>
   </keywords>
</movie>